{
  "schema_version": "evaluation-episode/v1",
  "episode_id": "mm-expand-image-ungrounded-001",
  "task": "出图后终态未引用产物",
  "framework": "tool_agent_fixture",
  "agent_version": "fixture-0.1",
  "split": "held_out",
  "acceptance_criteria": [
    "media process dimensions"
  ],
  "expected_state": {
    "status": "answered"
  },
  "final_state": {
    "status": "answered"
  },
  "state_verification": {
    "passed": true,
    "checks": [
      {
        "name": "answered",
        "passed": true
      }
    ]
  },
  "trajectory": {
    "session_id": "mm-expand-image-ungrounded-001",
    "query": "请生成登录页蓝色按钮图，并在答复中指出产物",
    "final_answer": "图里有蓝色按钮，可以发布。",
    "steps": [
      {
        "step": 1,
        "type": "thought",
        "thought": "先出图。"
      },
      {
        "step": 2,
        "type": "action",
        "step_kind": "generate_image",
        "action": {
          "name": "generate_image",
          "args": {
            "prompt": "login page mockup with a blue primary button"
          }
        },
        "artifacts": [
          {
            "uri": "examples/fixtures/artifacts/login_blue_button.png",
            "sha256": "0b457c939a634c18a4b31332846b0f6fd96237b3c346fd36fb7f2c97ac96a9ad"
          }
        ],
        "observation": {
          "summary": "generated sha256=0b457c939a634c18a4b31332846b0f6fd96237b3c346fd36fb7f2c97ac96a9ad"
        }
      },
      {
        "step": 3,
        "type": "final",
        "content": "图里有蓝色按钮，可以发布。"
      }
    ]
  },
  "metadata": {
    "evidence_role": "multimodal_step_process",
    "require_vision": true,
    "held_out_expand": true,
    "expected_failure_types": [
      "ungrounded_vision"
    ]
  }
}
