{
  "schema_version": "evaluation-episode/v1",
  "episode_id": "mm-expand-ok-video-alt-prompt-001",
  "task": "换一种安全 prompt 出视频并引用",
  "framework": "tool_agent_fixture",
  "agent_version": "fixture-0.1",
  "split": "held_out",
  "acceptance_criteria": [
    "media process dimensions"
  ],
  "expected_state": {
    "status": "answered"
  },
  "final_state": {
    "status": "answered"
  },
  "state_verification": {
    "passed": true,
    "checks": [
      {
        "name": "answered",
        "passed": true
      }
    ]
  },
  "trajectory": {
    "session_id": "mm-expand-ok-video-alt-prompt-001",
    "query": "请生成登录按钮点击演示短片，答复须含 sha256",
    "final_answer": "演示短片已就绪。sha256=742bb37209598fde51cd6c548ac5fcdfeae75b6bf545937b0a7bb55ef8599a73",
    "steps": [
      {
        "step": 1,
        "type": "thought",
        "thought": "安全出片并引用。"
      },
      {
        "step": 2,
        "type": "action",
        "step_kind": "generate_video",
        "action": {
          "name": "generate_video",
          "args": {
            "prompt": "short clean demo of blue login button click"
          }
        },
        "artifacts": [
          {
            "uri": "examples/fixtures/artifacts/login_button_clip.mp4",
            "sha256": "742bb37209598fde51cd6c548ac5fcdfeae75b6bf545937b0a7bb55ef8599a73"
          }
        ],
        "observation": {
          "summary": "generated sha256=742bb37209598fde51cd6c548ac5fcdfeae75b6bf545937b0a7bb55ef8599a73"
        }
      },
      {
        "step": 3,
        "type": "final",
        "content": "演示短片已就绪。sha256=742bb37209598fde51cd6c548ac5fcdfeae75b6bf545937b0a7bb55ef8599a73"
      }
    ]
  },
  "metadata": {
    "evidence_role": "multimodal_step_process",
    "require_vision": true,
    "held_out_expand": true
  }
}
