{
  "schema_version": "evaluation-episode/v1",
  "episode_id": "expense_heldout_boundary",
  "task": "Review claim C-H01 and persist the policy decision.",
  "framework": "react-agent-expense",
  "agent_version": "expense-agent-v1",
  "split": "held_out",
  "acceptance_criteria": [
    "boundary value accepted",
    "claim finalized once"
  ],
  "expected_state": {
    "claim": {
      "status": "approved",
      "decision": "approve_manager"
    },
    "audit": {
      "decision_events": 1
    }
  },
  "final_state": {
    "claim": {
      "category": "餐饮",
      "amount": 200,
      "has_receipt": true,
      "pre_approved": false,
      "status": "approved",
      "decision": "approve_manager"
    },
    "audit": {
      "decision_events": 1
    }
  },
  "state_verification": {
    "passed": true,
    "checks": [
      {
        "path": "$.claim.status",
        "expected": "approved",
        "actual": "approved",
        "passed": true
      },
      {
        "path": "$.claim.decision",
        "expected": "approve_manager",
        "actual": "approve_manager",
        "passed": true
      },
      {
        "path": "$.audit.decision_events",
        "expected": 1,
        "actual": 1,
        "passed": true
      }
    ]
  },
  "trajectory": {
    "session_id": "expense-expense_heldout_boundary-expense-agent-v1",
    "task_episode_id": "expense_heldout_boundary",
    "acceptance_criteria": [
      "boundary value accepted",
      "claim finalized once"
    ],
    "query": "Review claim C-H01 and persist the policy decision.",
    "model": "expense-agent-v1",
    "steps": [
      {
        "step": 1,
        "thought": "Inspect the claim before applying policy.",
        "action": {
          "name": "inspect_expense_claim",
          "arguments": "{\"claim_id\": \"C-H01\"}"
        },
        "observation": "{\"amount\": 200, \"category\": \"餐饮\", \"decision\": \"\", \"has_receipt\": true, \"pre_approved\": false, \"status\": \"pending\"}"
      },
      {
        "step": 2,
        "thought": "Apply the policy once with an idempotency key.",
        "action": {
          "name": "decide_expense_claim",
          "arguments": "{\"claim_id\": \"C-H01\", \"idempotency_key\": \"expense_heldout_boundary:decision\"}"
        },
        "observation": "{\"claim_id\": \"C-H01\", \"decision\": \"approve_manager\", \"status\": \"approved\"}"
      }
    ],
    "final_answer": "C-H01: approve_manager"
  },
  "metadata": {
    "domain": "expense",
    "verifier": "business_state_subset"
  }
}