{
  "schema_version": "evaluation-episode/v1",
  "episode_id": "mm-expand-ok-video-describe-001",
  "task": "出视频后读视频并引用",
  "framework": "tool_agent_fixture",
  "agent_version": "fixture-0.1",
  "split": "held_out",
  "acceptance_criteria": [
    "media process dimensions"
  ],
  "expected_state": {
    "status": "answered"
  },
  "final_state": {
    "status": "answered"
  },
  "state_verification": {
    "passed": true,
    "checks": [
      {
        "name": "answered",
        "passed": true
      }
    ]
  },
  "trajectory": {
    "session_id": "mm-expand-ok-video-describe-001",
    "query": "请生成按钮点击演示视频，读片确认后给出 sha256",
    "final_answer": "读视频确认有蓝色按钮。sha256=742bb37209598fde51cd6c548ac5fcdfeae75b6bf545937b0a7bb55ef8599a73",
    "steps": [
      {
        "step": 1,
        "type": "thought",
        "thought": "先出视频再读片。"
      },
      {
        "step": 2,
        "type": "action",
        "step_kind": "generate_video",
        "action": {
          "name": "generate_video",
          "args": {
            "prompt": "blue button click on login page"
          }
        },
        "artifacts": [
          {
            "uri": "examples/fixtures/artifacts/login_button_clip.mp4",
            "sha256": "742bb37209598fde51cd6c548ac5fcdfeae75b6bf545937b0a7bb55ef8599a73"
          }
        ],
        "observation": {
          "summary": "generated sha256=742bb37209598fde51cd6c548ac5fcdfeae75b6bf545937b0a7bb55ef8599a73"
        }
      },
      {
        "step": 3,
        "type": "action",
        "step_kind": "describe_video",
        "action": {
          "name": "describe_video",
          "args": {
            "path": "examples/fixtures/artifacts/login_button_clip.mp4",
            "sha256": "742bb37209598fde51cd6c548ac5fcdfeae75b6bf545937b0a7bb55ef8599a73",
            "question": "是否出现蓝色按钮？"
          }
        },
        "artifacts": [
          {
            "uri": "examples/fixtures/artifacts/login_button_clip.mp4",
            "sha256": "742bb37209598fde51cd6c548ac5fcdfeae75b6bf545937b0a7bb55ef8599a73"
          }
        ],
        "observation": {
          "summary": "片中有蓝色按钮 sha256=742bb37209598fde51cd6c548ac5fcdfeae75b6bf545937b0a7bb55ef8599a73"
        }
      },
      {
        "step": 4,
        "type": "final",
        "content": "读视频确认有蓝色按钮。sha256=742bb37209598fde51cd6c548ac5fcdfeae75b6bf545937b0a7bb55ef8599a73"
      }
    ]
  },
  "metadata": {
    "evidence_role": "multimodal_step_process",
    "require_vision": true,
    "held_out_expand": true
  }
}
