{
  "schema_version": "evaluation-episode/v1",
  "episode_id": "support_business_video_cite_uri_no_sha",
  "task": "客服演示视频终态必须引用 sha256，仅 uri 不够",
  "framework": "react-agent-support",
  "agent_version": "support-agent-v1+video",
  "split": "held_out",
  "acceptance_criteria": [
    "终态必须引用视频 sha256"
  ],
  "expected_state": {
    "status": "answered",
    "ticket": {"resolution": "demo_sent"}
  },
  "final_state": {
    "status": "answered",
    "ticket": {"resolution": "demo_sent"}
  },
  "state_verification": {
    "passed": true,
    "checks": [
      {"path": "$.status", "expected": "answered", "actual": "answered", "passed": true}
    ]
  },
  "trajectory": {
    "session_id": "support-business-video-cite-uri-no-sha-v1",
    "query": "请生成登录页蓝色按钮点击演示视频，并在答复里给出产物 sha256。",
    "model": "support-agent-v1+video",
    "steps": [
      {"step": 1, "type": "thought", "thought": "出片后应写哈希。"},
      {
        "step": 2,
        "type": "action",
        "step_kind": "generate_video",
        "action": {
          "name": "generate_video",
          "args": {"prompt": "login page blue button being clicked"}
        },
        "artifacts": [
          {
            "uri": "examples/business/artifacts/demo_login_button.mp4",
            "sha256": "742bb37209598fde51cd6c548ac5fcdfeae75b6bf545937b0a7bb55ef8599a73"
          }
        ],
        "observation": {
          "summary": "generated examples/business/artifacts/demo_login_button.mp4 sha256=742bb37209598fde51cd6c548ac5fcdfeae75b6bf545937b0a7bb55ef8599a73"
        }
      },
      {
        "step": 3,
        "type": "final",
        "content": "演示视频见 examples/business/artifacts/demo_login_button.mp4（未写 sha256）。"
      }
    ],
    "final_answer": "演示视频见 examples/business/artifacts/demo_login_button.mp4（未写 sha256）。"
  },
  "metadata": {
    "domain": "support",
    "evidence_role": "multimodal_step_process",
    "source": "business_non_fixture",
    "require_vision": true,
    "expected_failure_types": ["ungrounded_vision"]
  }
}
