{
  "schema_version": "evaluation-episode/v1",
  "episode_id": "mm-expand-describe-empty-question-001",
  "task": "读图 question 为空",
  "framework": "tool_agent_fixture",
  "agent_version": "fixture-0.1",
  "split": "held_out",
  "acceptance_criteria": [
    "media process dimensions"
  ],
  "expected_state": {
    "status": "answered"
  },
  "final_state": {
    "status": "answered"
  },
  "state_verification": {
    "passed": true,
    "checks": [
      {
        "name": "answered",
        "passed": true
      }
    ]
  },
  "trajectory": {
    "session_id": "mm-expand-describe-empty-question-001",
    "query": "请读取 examples/fixtures/artifacts/login_blue_button.png sha256=0b457c939a634c18a4b31332846b0f6fd96237b3c346fd36fb7f2c97ac96a9ad 询问是否有蓝色按钮",
    "final_answer": "question 为空仍给结论。sha256=0b457c939a634c18a4b31332846b0f6fd96237b3c346fd36fb7f2c97ac96a9ad",
    "steps": [
      {
        "step": 1,
        "type": "thought",
        "thought": "question 不能为空。"
      },
      {
        "step": 2,
        "type": "action",
        "step_kind": "describe_image",
        "action": {
          "name": "describe_image",
          "args": {
            "path": "examples/fixtures/artifacts/login_blue_button.png",
            "sha256": "0b457c939a634c18a4b31332846b0f6fd96237b3c346fd36fb7f2c97ac96a9ad",
            "question": ""
          }
        },
        "artifacts": [
          {
            "uri": "examples/fixtures/artifacts/login_blue_button.png",
            "sha256": "0b457c939a634c18a4b31332846b0f6fd96237b3c346fd36fb7f2c97ac96a9ad"
          }
        ],
        "observation": {
          "summary": "empty question sha256=0b457c939a634c18a4b31332846b0f6fd96237b3c346fd36fb7f2c97ac96a9ad"
        }
      },
      {
        "step": 3,
        "type": "final",
        "content": "question 为空仍给结论。sha256=0b457c939a634c18a4b31332846b0f6fd96237b3c346fd36fb7f2c97ac96a9ad"
      }
    ]
  },
  "metadata": {
    "evidence_role": "multimodal_step_process",
    "require_vision": true,
    "held_out_expand": true,
    "expected_failure_types": [
      "wrong_media_args"
    ]
  }
}
