{
  "schema_version": "evaluation-episode/v1",
  "episode_id": "mm-step-read-write-ok-001",
  "task": "根据用户描述生成产品示意图，再读图确认关键元素后回复",
  "framework": "tool_agent_fixture",
  "agent_version": "fixture-0.1",
  "split": "held_out",
  "acceptance_criteria": [
    "需要视觉证据时才调用 generate_image",
    "artifacts 只保留 uri 与 sha256",
    "最终答复引用该 sha256"
  ],
  "expected_state": {
    "status": "answered"
  },
  "final_state": {
    "status": "answered"
  },
  "state_verification": {
    "passed": true,
    "checks": [
      {
        "name": "answered",
        "passed": true
      }
    ]
  },
  "trajectory": {
    "session_id": "mm-step-ok-001",
    "query": "请生成一张带蓝色按钮的登录页截图，并确认图中是否有蓝色按钮",
    "final_answer": "读图确认有蓝色按钮。产物 sha256=0b457c939a634c18a4b31332846b0f6fd96237b3c346fd36fb7f2c97ac96a9ad",
    "steps": [
      {
        "step": 1,
        "type": "thought",
        "thought": "任务需要视觉证据，应先出图再读图确认。",
        "judge_scores": {
          "context": 4
        }
      },
      {
        "step": 2,
        "type": "action",
        "step_kind": "generate_image",
        "action": {
          "name": "generate_image",
          "args": {
            "prompt": "login page mockup with a blue primary button"
          }
        },
        "artifacts": [
          {
            "uri": "examples/fixtures/artifacts/login_blue_button.png",
            "sha256": "0b457c939a634c18a4b31332846b0f6fd96237b3c346fd36fb7f2c97ac96a9ad"
          }
        ],
        "observation": {
          "summary": "generated examples/fixtures/artifacts/login_blue_button.png sha256=0b457c939a634c18a4b31332846b0f6fd96237b3c346fd36fb7f2c97ac96a9ad"
        },
        "judge_scores": {
          "media_timing": 5,
          "media_arg_fidelity": 4,
          "artifact_attachment": 5,
          "media_safety": 5
        }
      },
      {
        "step": 3,
        "type": "action",
        "step_kind": "describe_image",
        "action": {
          "name": "describe_image",
          "args": {
            "path": "examples/fixtures/artifacts/login_blue_button.png",
            "sha256": "0b457c939a634c18a4b31332846b0f6fd96237b3c346fd36fb7f2c97ac96a9ad",
            "question": "是否有蓝色按钮？"
          }
        },
        "artifacts": [
          {
            "uri": "examples/fixtures/artifacts/login_blue_button.png",
            "sha256": "0b457c939a634c18a4b31332846b0f6fd96237b3c346fd36fb7f2c97ac96a9ad"
          }
        ],
        "observation": {
          "summary": "图中有蓝色主按钮 sha256=0b457c939a634c18a4b31332846b0f6fd96237b3c346fd36fb7f2c97ac96a9ad"
        },
        "judge_scores": {
          "media_timing": 5,
          "media_arg_fidelity": 4,
          "artifact_attachment": 5,
          "media_safety": 5
        }
      },
      {
        "step": 4,
        "type": "final",
        "content": "读图确认有蓝色按钮。产物 sha256=0b457c939a634c18a4b31332846b0f6fd96237b3c346fd36fb7f2c97ac96a9ad",
        "judge_scores": {
          "media_timing": 5,
          "media_arg_fidelity": 4,
          "artifact_attachment": 5,
          "media_safety": 5
        }
      }
    ]
  },
  "metadata": {
    "evidence_role": "multimodal_step_process",
    "require_vision": true
  }
}
