{
  "schema_version": "evaluation-episode/v1",
  "episode_id": "mm-expand-describe-missing-path-001",
  "task": "读图缺少 path 参数",
  "framework": "tool_agent_fixture",
  "agent_version": "fixture-0.1",
  "split": "held_out",
  "acceptance_criteria": [
    "media process dimensions"
  ],
  "expected_state": {
    "status": "answered"
  },
  "final_state": {
    "status": "answered"
  },
  "state_verification": {
    "passed": true,
    "checks": [
      {
        "name": "answered",
        "passed": true
      }
    ]
  },
  "trajectory": {
    "session_id": "mm-expand-describe-missing-path-001",
    "query": "请读取 sha256=0b457c939a634c18a4b31332846b0f6fd96237b3c346fd36fb7f2c97ac96a9ad 的截图并确认蓝色按钮",
    "final_answer": "未给 path 仍声称读到蓝色按钮。",
    "steps": [
      {
        "step": 1,
        "type": "thought",
        "thought": "必须带 path。"
      },
      {
        "step": 2,
        "type": "action",
        "step_kind": "describe_image",
        "action": {
          "name": "describe_image",
          "args": {
            "sha256": "0b457c939a634c18a4b31332846b0f6fd96237b3c346fd36fb7f2c97ac96a9ad",
            "question": "是否有蓝色按钮？"
          }
        },
        "observation": {
          "summary": "missing path arg"
        }
      },
      {
        "step": 3,
        "type": "final",
        "content": "未给 path 仍声称读到蓝色按钮。"
      }
    ]
  },
  "metadata": {
    "evidence_role": "multimodal_step_process",
    "require_vision": true,
    "held_out_expand": true,
    "expected_failure_types": [
      "wrong_media_args",
      "ungrounded_vision"
    ]
  }
}
