{
  "schema_version": "evaluation-episode/v1",
  "episode_id": "mm-expand-double-generate-001",
  "task": "不应重复多余出图",
  "framework": "tool_agent_fixture",
  "agent_version": "fixture-0.1",
  "split": "held_out",
  "acceptance_criteria": [
    "media process dimensions"
  ],
  "expected_state": {
    "status": "answered"
  },
  "final_state": {
    "status": "answered"
  },
  "state_verification": {
    "passed": true,
    "checks": [
      {
        "name": "answered",
        "passed": true
      }
    ]
  },
  "trajectory": {
    "session_id": "mm-expand-double-generate-001",
    "query": "请生成一张登录页蓝色按钮图并引用 sha256（只需一次出图）",
    "final_answer": "第二次才引用。sha256=0b457c939a634c18a4b31332846b0f6fd96237b3c346fd36fb7f2c97ac96a9ad",
    "steps": [
      {
        "step": 1,
        "type": "thought",
        "thought": "出一次图即可。"
      },
      {
        "step": 2,
        "type": "action",
        "step_kind": "generate_image",
        "action": {
          "name": "generate_image",
          "args": {
            "prompt": "login page blue button"
          }
        },
        "artifacts": [
          {
            "uri": "examples/fixtures/artifacts/login_blue_button.png",
            "sha256": "0b457c939a634c18a4b31332846b0f6fd96237b3c346fd36fb7f2c97ac96a9ad"
          }
        ],
        "observation": {
          "summary": "generated sha256=0b457c939a634c18a4b31332846b0f6fd96237b3c346fd36fb7f2c97ac96a9ad"
        }
      },
      {
        "step": 3,
        "type": "action",
        "step_kind": "generate_image",
        "action": {
          "name": "generate_image",
          "args": {
            "prompt": "login page blue button again"
          }
        },
        "artifacts": [
          {
            "uri": "examples/fixtures/artifacts/login_blue_button.png",
            "sha256": "0b457c939a634c18a4b31332846b0f6fd96237b3c346fd36fb7f2c97ac96a9ad"
          }
        ],
        "observation": {
          "summary": "generated again sha256=0b457c939a634c18a4b31332846b0f6fd96237b3c346fd36fb7f2c97ac96a9ad"
        }
      },
      {
        "step": 4,
        "type": "final",
        "content": "第二次才引用。sha256=0b457c939a634c18a4b31332846b0f6fd96237b3c346fd36fb7f2c97ac96a9ad"
      }
    ]
  },
  "metadata": {
    "evidence_role": "multimodal_step_process",
    "require_vision": true,
    "held_out_expand": true,
    "expected_failure_types": [
      "unnecessary_generation"
    ]
  }
}
