{
  "schema_version": "evaluation-episode/v1",
  "episode_id": "mm-expand-ungrounded-after-describe-001",
  "task": "读图成功但终态未引用产物",
  "framework": "tool_agent_fixture",
  "agent_version": "fixture-0.1",
  "split": "held_out",
  "acceptance_criteria": [
    "media process dimensions"
  ],
  "expected_state": {
    "status": "answered"
  },
  "final_state": {
    "status": "answered"
  },
  "state_verification": {
    "passed": true,
    "checks": [
      {
        "name": "answered",
        "passed": true
      }
    ]
  },
  "trajectory": {
    "session_id": "mm-expand-ungrounded-after-describe-001",
    "query": "请读取 examples/fixtures/artifacts/login_blue_button.png sha256=0b457c939a634c18a4b31332846b0f6fd96237b3c346fd36fb7f2c97ac96a9ad 确认蓝色按钮，并在答复中引用哈希",
    "final_answer": "读图后说有蓝色按钮，但未写哈希。",
    "steps": [
      {
        "step": 1,
        "type": "thought",
        "thought": "读图后要引用。"
      },
      {
        "step": 2,
        "type": "action",
        "step_kind": "describe_image",
        "action": {
          "name": "describe_image",
          "args": {
            "path": "examples/fixtures/artifacts/login_blue_button.png",
            "sha256": "0b457c939a634c18a4b31332846b0f6fd96237b3c346fd36fb7f2c97ac96a9ad",
            "question": "是否有蓝色按钮？"
          }
        },
        "artifacts": [
          {
            "uri": "examples/fixtures/artifacts/login_blue_button.png",
            "sha256": "0b457c939a634c18a4b31332846b0f6fd96237b3c346fd36fb7f2c97ac96a9ad"
          }
        ],
        "observation": {
          "summary": "有蓝色按钮 sha256=0b457c939a634c18a4b31332846b0f6fd96237b3c346fd36fb7f2c97ac96a9ad"
        }
      },
      {
        "step": 3,
        "type": "final",
        "content": "读图后说有蓝色按钮，但未写哈希。"
      }
    ]
  },
  "metadata": {
    "evidence_role": "multimodal_step_process",
    "require_vision": true,
    "held_out_expand": true,
    "expected_failure_types": [
      "ungrounded_vision"
    ]
  }
}
