{
  "schema_version": "evaluation-episode/v1",
  "episode_id": "mm-expand-video-ungrounded-001",
  "task": "出视频后终态未引用产物",
  "framework": "tool_agent_fixture",
  "agent_version": "fixture-0.1",
  "split": "held_out",
  "acceptance_criteria": [
    "media process dimensions"
  ],
  "expected_state": {
    "status": "answered"
  },
  "final_state": {
    "status": "answered"
  },
  "state_verification": {
    "passed": true,
    "checks": [
      {
        "name": "answered",
        "passed": true
      }
    ]
  },
  "trajectory": {
    "session_id": "mm-expand-video-ungrounded-001",
    "query": "请生成蓝色按钮点击演示视频，并在答复中指出产物",
    "final_answer": "片中有蓝色按钮，可以发布。",
    "steps": [
      {
        "step": 1,
        "type": "thought",
        "thought": "需要视频。"
      },
      {
        "step": 2,
        "type": "action",
        "step_kind": "generate_video",
        "action": {
          "name": "generate_video",
          "args": {
            "prompt": "blue button click demo"
          }
        },
        "artifacts": [
          {
            "uri": "examples/fixtures/artifacts/login_button_clip.mp4",
            "sha256": "742bb37209598fde51cd6c548ac5fcdfeae75b6bf545937b0a7bb55ef8599a73"
          }
        ],
        "observation": {
          "summary": "generated sha256=742bb37209598fde51cd6c548ac5fcdfeae75b6bf545937b0a7bb55ef8599a73"
        }
      },
      {
        "step": 3,
        "type": "final",
        "content": "片中有蓝色按钮，可以发布。"
      }
    ]
  },
  "metadata": {
    "evidence_role": "multimodal_step_process",
    "require_vision": true,
    "held_out_expand": true,
    "expected_failure_types": [
      "ungrounded_vision"
    ]
  }
}
