{
  "schema_version": "evaluation-episode/v1",
  "episode_id": "mm-expand-ok-describe-image-known-001",
  "task": "已知产物只读图并引用哈希",
  "framework": "tool_agent_fixture",
  "agent_version": "fixture-0.1",
  "split": "held_out",
  "acceptance_criteria": [
    "media process dimensions"
  ],
  "expected_state": {
    "status": "answered"
  },
  "final_state": {
    "status": "answered"
  },
  "state_verification": {
    "passed": true,
    "checks": [
      {
        "name": "answered",
        "passed": true
      }
    ]
  },
  "trajectory": {
    "session_id": "mm-expand-ok-describe-image-known-001",
    "query": "已知截图 examples/fixtures/artifacts/login_blue_button.png sha256=0b457c939a634c18a4b31332846b0f6fd96237b3c346fd36fb7f2c97ac96a9ad，请确认蓝色按钮并引用哈希",
    "final_answer": "确认有蓝色按钮。sha256=0b457c939a634c18a4b31332846b0f6fd96237b3c346fd36fb7f2c97ac96a9ad",
    "steps": [
      {
        "step": 1,
        "type": "thought",
        "thought": "直接读已知图。"
      },
      {
        "step": 2,
        "type": "action",
        "step_kind": "describe_image",
        "action": {
          "name": "describe_image",
          "args": {
            "path": "examples/fixtures/artifacts/login_blue_button.png",
            "sha256": "0b457c939a634c18a4b31332846b0f6fd96237b3c346fd36fb7f2c97ac96a9ad",
            "question": "主按钮是蓝色吗？"
          }
        },
        "artifacts": [
          {
            "uri": "examples/fixtures/artifacts/login_blue_button.png",
            "sha256": "0b457c939a634c18a4b31332846b0f6fd96237b3c346fd36fb7f2c97ac96a9ad"
          }
        ],
        "observation": {
          "summary": "蓝色主按钮可见 sha256=0b457c939a634c18a4b31332846b0f6fd96237b3c346fd36fb7f2c97ac96a9ad"
        }
      },
      {
        "step": 3,
        "type": "final",
        "content": "确认有蓝色按钮。sha256=0b457c939a634c18a4b31332846b0f6fd96237b3c346fd36fb7f2c97ac96a9ad"
      }
    ]
  },
  "metadata": {
    "evidence_role": "multimodal_step_process",
    "require_vision": true,
    "held_out_expand": true
  }
}
